{
  "content": "Tom said that everyone he knows does that.",
  "language": "eng",
  "tags": [
    "eng:tatoeba-sentence"
  ],
  "credits": [
    "Sentence from Tatoeba by CK (CC-BY 2.0 FR)"
  ],
  "relationships": [
    [
      "TRANSLATION",
      "ita:Tom ha detto che tutti quelli che conosce lo fanno"
    ]
  ]
}
