{
  "content": "Perché Tom ha cominciato a studiare il francese?",
  "language": "ita",
  "tags": [
    "eng:tatoeba-sentence"
  ],
  "credits": [
    "Sentence from Tatoeba by Guybrush88 (CC-BY 2.0 FR)"
  ],
  "relationships": [
    [
      "TRANSLATION",
      "eng:Why did Tom start studying French﹖"
    ]
  ]
}
