{
  "content": "¿Puedes decirme la hora, por favor?",
  "language": "spa",
  "transcriptions": {},
  "logs": {},
  "tags": [],
  "needsHumanCheck": false,
  "excludeFromLearning": false,
  "relationships": [
    [
      "TRANSLATION",
      "eng:Can you tell me the time, please﹖"
    ],
    [
      "TRANSLATION",
      "eng:Could you let me know the time, please﹖"
    ],
    [
      "TRANSLATION",
      "eng:Please tell me what time it is"
    ]
  ]
}
