{
  "content": "In ogni caso, vi chiamerò domani.",
  "language": "ita",
  "tags": [
    "eng:tatoeba-sentence"
  ],
  "credits": [
    "Sentence from Tatoeba by Guybrush88 (CC-BY 2.0 FR)"
  ],
  "relationships": [
    [
      "TRANSLATION",
      "eng:In any case, I'll call you tomorrow"
    ]
  ]
}
