{
  "content": "I no longer recognise her, she's so distant.",
  "language": "eng",
  "tags": [
    "eng:tatoeba-sentence"
  ],
  "credits": [
    "Sentence from Tatoeba by Nuel (CC-BY 2.0 FR)"
  ],
  "relationships": [
    [
      "TRANSLATION",
      "ita:Non la riconosco più, è così distante"
    ]
  ]
}
