{
  "content": "È sicuro che abbiamo abbastanza birra?",
  "language": "ita",
  "tags": [
    "eng:tatoeba-sentence"
  ],
  "credits": [
    "Sentence from Tatoeba by Guybrush88 (CC-BY 2.0 FR)"
  ],
  "relationships": [
    [
      "TRANSLATION",
      "eng:Are you sure we have enough beer﹖"
    ]
  ]
}
