{
  "content": "Lui ha dimostrato di essere un marito ideale.",
  "language": "ita",
  "tags": [
    "eng:tatoeba-sentence"
  ],
  "credits": [
    "Sentence from Tatoeba by Guybrush88 (CC-BY 2.0 FR)"
  ],
  "relationships": [
    [
      "TRANSLATION",
      "eng:He proved to be an ideal husband"
    ]
  ]
}
