{
  "content": "Tom says he did nothing illegal.",
  "language": "eng",
  "tags": [
    "eng:tatoeba-sentence"
  ],
  "credits": [
    "Sentence from Tatoeba by CK (CC-BY 2.0 FR)"
  ],
  "relationships": [
    [
      "TRANSLATION",
      "ita:Tom dice che non ha fatto niente di illegale"
    ],
    [
      "TRANSLATION",
      "ita:Tom dice che non ha fatto nulla di illegale"
    ]
  ]
}
