{
  "content": "He presented his card.",
  "language": "eng",
  "tags": [
    "eng:tatoeba-sentence"
  ],
  "credits": [
    "Sentence from Tatoeba by CK (CC-BY 2.0 FR)"
  ],
  "relationships": [
    [
      "TRANSLATION",
      "ita:Ha presentato la sua carta"
    ],
    [
      "TRANSLATION",
      "ita:Presentò la sua carta"
    ]
  ]
}
