{
  "content": "Penso che sia un bene che i libri esistano ancora, però mi fanno venire voglia di dormire.",
  "language": "ita",
  "tags": [
    "eng:tatoeba-sentence"
  ],
  "credits": [
    "Sentence from Tatoeba by Pharamp (CC-BY 2.0 FR)"
  ],
  "relationships": [
    [
      "TRANSLATION",
      "eng:I think it is good that books still exist, but they do make me sleepy"
    ]
  ]
}
