{
  "content": "Gli Stati Uniti sono un paese di immigrati.",
  "language": "ita",
  "tags": [
    "eng:tatoeba-sentence"
  ],
  "credits": [
    "Sentence from Tatoeba by Guybrush88 (CC-BY 2.0 FR)"
  ],
  "relationships": [
    [
      "TRANSLATION",
      "eng:The United States is a country of immigrants"
    ]
  ]
}
