{
  "content": "The imam arrived at four.",
  "language": "eng",
  "tags": [
    "eng:tatoeba-sentence"
  ],
  "credits": [
    "Sentence from Tatoeba by Amastan (CC-BY 2.0 FR)"
  ],
  "relationships": [
    [
      "TRANSLATION",
      "ita:L'imam arrivò alle quattro"
    ],
    [
      "TRANSLATION",
      "ita:L'imam è arrivato alle quattro"
    ]
  ]
}
