{
  "content": "They go to church on Sunday morning.",
  "language": "eng",
  "tags": [
    "eng:tatoeba-sentence"
  ],
  "credits": [
    "Sentence from Tatoeba by CK (CC-BY 2.0 FR)"
  ],
  "relationships": [
    [
      "TRANSLATION",
      "ita:Loro vanno in chiesa domenica mattina"
    ],
    [
      "TRANSLATION",
      "ita:Loro vanno in chiesa la domenica mattina"
    ],
    [
      "TRANSLATION",
      "ita:Vanno in chiesa domenica mattina"
    ],
    [
      "TRANSLATION",
      "ita:Vanno in chiesa la domenica mattina"
    ]
  ]
}
