{
  "content": "I can't leave Australia.",
  "language": "eng",
  "tags": [
    "eng:tatoeba-sentence"
  ],
  "credits": [
    "Sentence from Tatoeba by CK (CC-BY 2.0 FR)"
  ],
  "relationships": [
    [
      "TRANSLATION",
      "ita:Io non posso lasciare l'Australia"
    ],
    [
      "TRANSLATION",
      "ita:Non posso lasciare l'Australia"
    ]
  ]
}
