{
  "content": "Does Tom still have your key?",
  "language": "eng",
  "tags": [
    "eng:tatoeba-sentence"
  ],
  "credits": [
    "Sentence from Tatoeba by CK (CC-BY 2.0 FR)"
  ],
  "relationships": [
    [
      "TRANSLATION",
      "ita:Tom ha ancora la sua chiave﹖"
    ],
    [
      "TRANSLATION",
      "ita:Tom ha ancora la tua chiave﹖"
    ],
    [
      "TRANSLATION",
      "ita:Tom ha ancora la vostra chiave﹖"
    ]
  ]
}
