{
  "content": "foglalkozunk",
  "language": "hun",
  "tags": [
    "eng:tatoeba-sentence-part"
  ],
  "relationships": [
    [
      "USAGE_EXAMPLE",
      "hun:Azt hittem, ezzel majd később foglalkozunk"
    ],
    [
      "TRANSLATION",
      "eng:We specialize in",
      "Auto-translated with translategemma:4b"
    ]
  ],
  "logs": {
    "2026-04-01T08:35:57.547017Z": "TRANSLATION_DONE:eng"
  }
}
