{
  "content": "eikö",
  "language": "fin",
  "tags": [
    "eng:tatoeba-sentence-part"
  ],
  "relationships": [
    [
      "USAGE_EXAMPLE",
      "fin:Hän ei ole täällä nyt, eikö niin﹖"
    ],
    [
      "USAGE_EXAMPLE",
      "fin:Tomi on kuuluisa näyttelijä, eikö niin﹖"
    ],
    [
      "TRANSLATION",
      "eng:whether",
      "Auto-translated with argostranslate (fi→en)"
    ],
    [
      "USAGE_EXAMPLE",
      "fin:Sinä olet Tomin tytär, eikö niin﹖"
    ],
    [
      "USAGE_EXAMPLE",
      "fin:Sinä osaat tehdä tämän, eikö niin﹖"
    ],
    [
      "USAGE_EXAMPLE",
      "fin:Te olette kaikki varmaan nälkäisiä, eikö vain﹖"
    ],
    [
      "USAGE_EXAMPLE",
      "fin:Olette opiskelijoita, eikö vaan﹖"
    ],
    [
      "USAGE_EXAMPLE",
      "fin:Te olette opiskelijoita, eikö niin﹖"
    ],
    [
      "USAGE_EXAMPLE",
      "fin:Sinä varmaan luulet, että minä valehtelen, eikö vain﹖"
    ],
    [
      "USAGE_EXAMPLE",
      "fin:Teillä kaikilla on varmaan nälkä, eikö niin﹖"
    ],
    [
      "USAGE_EXAMPLE",
      "fin:Olemme yhdessä kiinni tässä asiassa, eikö niin﹖"
    ],
    [
      "USAGE_EXAMPLE",
      "fin:Tämä on meidän vikamme, eikö olekin﹖"
    ],
    [
      "USAGE_EXAMPLE",
      "fin:Me olemme täällä turvassa, eikö niin﹖"
    ]
  ],
  "logs": {
    "2026-03-31T12:45:14.216634Z": "TRANSLATION_DONE:eng"
  }
}
