{
  "content": "I told them I didn't want to go.",
  "language": "eng",
  "tags": [
    "eng:tatoeba-sentence"
  ],
  "credits": [
    "Sentence from Tatoeba by CH (CC-BY 2.0 FR)"
  ],
  "relationships": [
    [
      "TRANSLATION",
      "ita:Dissi loro che non volevo andare"
    ],
    [
      "TRANSLATION",
      "ita:Ho detto loro che non volevo andare"
    ]
  ]
}
