{
  "content": "Jack non ha fatto errori nella verifica di matematica.",
  "language": "ita",
  "tags": [
    "eng:tatoeba-sentence"
  ],
  "credits": [
    "Sentence from Tatoeba by Guybrush88 (CC-BY 2.0 FR)"
  ],
  "relationships": [
    [
      "TRANSLATION",
      "eng:Jack made no mistakes in the math test"
    ]
  ]
}
