{
  "content": "поїхати",
  "language": "ukr",
  "tags": [
    "eng:tatoeba-sentence-part"
  ],
  "relationships": [
    [
      "USAGE_EXAMPLE",
      "ukr:Куди ти хотів би поїхати﹖"
    ],
    [
      "TRANSLATION",
      "eng:Go",
      "Auto-translated with argostranslate (uk→en)"
    ],
    [
      "TRANSLATION",
      "deu:Los",
      "Auto-translated with argostranslate (uk→en→de)"
    ]
  ],
  "logs": {
    "2026-03-31T12:55:07.301759Z": "TRANSLATION_DONE:eng",
    "2026-03-31T12:55:07.321091Z": "TRANSLATION_DONE:deu"
  }
}
