{
  "content": "I like you, too.",
  "language": "eng",
  "tags": [
    "eng:tatoeba-sentence"
  ],
  "credits": [
    "Sentence from Tatoeba by CK (CC-BY 2.0 FR)"
  ],
  "relationships": [
    [
      "TRANSLATION",
      "ita:Anche lei mi piace"
    ],
    [
      "TRANSLATION",
      "ita:Anche tu mi piaci"
    ],
    [
      "TRANSLATION",
      "ita:Anche voi mi piacete"
    ]
  ]
}
