{
  "content": "Mary è piuttosto ambiziosa, vero?",
  "language": "ita",
  "tags": [
    "eng:tatoeba-sentence"
  ],
  "credits": [
    "Sentence from Tatoeba by Guybrush88 (CC-BY 2.0 FR)"
  ],
  "relationships": [
    [
      "TRANSLATION",
      "eng:Mary is quite ambitious, isn't she﹖"
    ]
  ]
}
