{
  "content": "Prenderò il prossimo treno.",
  "language": "ita",
  "tags": [
    "eng:tatoeba-sentence"
  ],
  "credits": [
    "Sentence from Tatoeba by Guybrush88 (CC-BY 2.0 FR)"
  ],
  "relationships": [
    [
      "TRANSLATION",
      "eng:I'll catch the next train"
    ],
    [
      "TRANSLATION",
      "eng:I'll take the next train"
    ]
  ]
}
