{
  "content": "La bambina non mi lasciava vedere il giocattolo.",
  "language": "ita",
  "tags": [
    "eng:tatoeba-sentence"
  ],
  "credits": [
    "Sentence from Tatoeba by fekundulo (CC-BY 2.0 FR)"
  ],
  "relationships": [
    [
      "TRANSLATION",
      "eng:The baby girl didn't let me see the toy"
    ]
  ]
}
